{
    "$schema": "http://json-schema.org/draft-04/schema#",
    "type": "object",
    "required": [ "id" ],
    "properties": {
        "id": { "type": "string" },
        "actionId": { "type": "string" },
        "status": { "type": "string" },
        "closeSignal": { "type": "boolean" },
        "isValidReply": { "type": "boolean" },
        "data": { "type": "object" }
    }
}